{
  "$schema": "http://json-schema.org/draft-07/schema#",
  "title": "Sentinel Rating Template Schema",
  "description": "Schema for defining rating templates in the Sentinel content rating system",
  "type": "object",
  "properties": {
    "template_id": {
      "type": "string",
      "description": "Unique identifier for the rating template",
      "pattern": "^[a-z_]+$"
    },
    "template_name": {
      "type": "string",
      "description": "Human-readable name for the template"
    },
    "template_version": {
      "type": "string",
      "description": "Version of the template",
      "pattern": "^\\d+\\.\\d+\\.\\d+$"
    },
    "description": {
      "type": "string",
      "description": "Description of the template's purpose and use cases"
    },
    "rating_dimensions": {
      "type": "object",
      "description": "Collection of rating dimensions",
      "patternProperties": {
        "^[a-z_]+$": {
          "type": "object",
          "properties": {
            "name": {
              "type": "string",
              "description": "Human-readable name for the dimension"
            },
            "max": {
              "type": "integer",
              "minimum": 1,
              "maximum": 10,
              "description": "Maximum rating value"
            },
            "min": {
              "type": "integer",
              "minimum": 1,
              "maximum": 10,
              "description": "Minimum rating value",
              "default": 1
            },
            "description": {
              "type": "object",
              "description": "Descriptions for rating values",
              "patternProperties": {
                "^\\d+$": {
                  "type": "string",
                  "description": "Description for specific rating value"
                }
              }
            },
            "category": {
              "type": "string",
              "enum": ["political", "content", "discrimination", "quality", "service"],
              "description": "Category of the rating dimension"
            },
            "weight": {
              "type": "number",
              "minimum": 0,
              "maximum": 1,
              "default": 1,
              "description": "Weight of this dimension in overall rating calculation"
            }
          },
          "required": ["name", "max", "description"],
          "additionalProperties": false
        }
      }
    },
    "metadata": {
      "type": "object",
      "properties": {
        "author": {
          "type": "string",
          "description": "Template author or organization"
        },
        "created_date": {
          "type": "string",
          "format": "date-time",
          "description": "Template creation date"
        },
        "last_modified": {
          "type": "string",
          "format": "date-time",
          "description": "Last modification date"
        },
        "license": {
          "type": "string",
          "description": "License information for the template"
        },
        "tags": {
          "type": "array",
          "items": {
            "type": "string"
          },
          "description": "Tags for categorizing the template"
        }
      }
    }
  },
  "required": ["template_id", "template_name", "template_version", "rating_dimensions"],
  "additionalProperties": false
}

